{
  "schemaVersion": 1,
  "datasetId": "san11.generic.inventory.20261007",
  "evidence": "public-guide-transcription",
  "executionEnabled": false,
  "observationCount": 33,
  "eventCount": 31,
  "coverageScope": "Complete selected Wiki88 generic heading section only, plus two selected GamerSky2009 observations. Not a complete original-game catalog.",
  "wikiCoverageCounts": {
    "substantive": 6,
    "conditions-only": 2,
    "unverified-anecdote": 1,
    "qualitative-result-only": 1,
    "heading-only": 21
  },
  "gamerskySelectedCount": 2,
  "sources": [
    {
      "sourceId": "atwiki-88-generic",
      "url": "https://w.atwiki.jp/sangokushi11/pages/88.html",
      "retrievalKind": "web-tool-rendered-text-snapshot",
      "observedAt": "2026-10-07T14:32:54Z",
      "snapshotFile": "atwiki-88-generic.web-lines.txt",
      "snapshotSha256": "c20f0e46e0f2d7a7dd23650c7da7ab0cf419aea9302bb2a37e39fff1cc3300d9",
      "lineNumberKind": "web-tool-rendered-lines-not-html",
      "selectionStartLine": 1126,
      "selectionEndLine": 1287,
      "sourceCrawlAgeReported": "yesterday",
      "rawHtmlAvailable": false,
      "expectedObservationCount": 31,
      "observationIds": [
        "generic.atwiki88.01",
        "generic.atwiki88.02",
        "generic.atwiki88.03",
        "generic.atwiki88.04",
        "generic.atwiki88.05",
        "generic.atwiki88.06",
        "generic.atwiki88.07",
        "generic.atwiki88.08",
        "generic.atwiki88.09",
        "generic.atwiki88.10",
        "generic.atwiki88.11",
        "generic.atwiki88.12",
        "generic.atwiki88.13",
        "generic.atwiki88.14",
        "generic.atwiki88.15",
        "generic.atwiki88.16",
        "generic.atwiki88.17",
        "generic.atwiki88.18",
        "generic.atwiki88.19",
        "generic.atwiki88.20",
        "generic.atwiki88.21",
        "generic.atwiki88.22",
        "generic.atwiki88.23",
        "generic.atwiki88.24",
        "generic.atwiki88.25",
        "generic.atwiki88.26",
        "generic.atwiki88.27",
        "generic.atwiki88.28",
        "generic.atwiki88.29",
        "generic.atwiki88.30",
        "generic.atwiki88.31"
      ],
      "originalTitles": [
        "統一前反乱疑惑",
        "銅雀台",
        "推挙－文官",
        "推挙－武官",
        "五虎将",
        "遺跡発見",
        "廟発見",
        "遺跡、廟破壊",
        "少帝即位",
        "献帝即位",
        "献帝崩御",
        "旅人訪問・管輅",
        "旅人訪問・許劭",
        "旅人訪問・華佗",
        "旅人訪問・于吉",
        "旅人訪問・禰衡",
        "旅人訪問・司馬徽Ａ",
        "旅人訪問・司馬徽Ｂ",
        "旅人訪問・黄承彦",
        "夫婦の助け",
        "義兄弟の気炎",
        "泰山封禅",
        "義勇兵",
        "嘆願",
        "災害援助",
        "漢帝密使",
        "漢帝援助",
        "賞賛",
        "誹謗",
        "修行報告・知系",
        "修行報告・武系"
      ]
    },
    {
      "sourceId": "gamersky-2009-01",
      "url": "https://www.gamersky.com/handbook/200902/134257.shtml",
      "retrievalKind": "web-tool-rendered-text-snapshot",
      "observedAt": "2026-10-07T14:32:54Z",
      "snapshotFile": "gamersky-2009-01.web-lines.txt",
      "snapshotSha256": "9b38bf7a82ec854ddcece92a618619289180b443cd289fe891f18e222da2c479",
      "lineNumberKind": "web-tool-rendered-lines-not-html",
      "selectionStartLine": 263,
      "selectionEndLine": 276,
      "sourceCrawlAgeReported": "last week",
      "rawHtmlAvailable": false,
      "expectedObservationCount": 1,
      "observationIds": [
        "generic.gamersky2009.01.bronze-sparrow"
      ],
      "originalTitles": [
        "铜雀台"
      ]
    },
    {
      "sourceId": "gamersky-2009-13",
      "url": "https://www.gamersky.com/handbook/200902/134257_13.shtml",
      "retrievalKind": "web-tool-rendered-text-snapshot",
      "observedAt": "2026-10-07T14:32:54Z",
      "snapshotFile": "gamersky-2009-13.web-lines.txt",
      "snapshotSha256": "1fd8f99a7cfb8af92133be43e10e802eb59badaac7222e38dc0ca5528b356d22",
      "lineNumberKind": "web-tool-rendered-lines-not-html",
      "selectionStartLine": 336,
      "selectionEndLine": 342,
      "sourceCrawlAgeReported": "last week",
      "rawHtmlAvailable": false,
      "expectedObservationCount": 1,
      "observationIds": [
        "generic.gamersky2009.13.taishan"
      ],
      "originalTitles": [
        "泰山封禅"
      ]
    }
  ],
  "mapping": [
    {
      "eventId": "generic.pre-unification-rebellion-suspicion",
      "observationIds": [
        "generic.atwiki88.01"
      ],
      "identityBasis": "selected-source-topic-not-native-id"
    },
    {
      "eventId": "generic.bronze-sparrow-acquisition",
      "observationIds": [
        "generic.atwiki88.02",
        "generic.gamersky2009.01.bronze-sparrow"
      ],
      "identityBasis": "selected-source-topic-not-native-id"
    },
    {
      "eventId": "generic.recommend-civil-officer",
      "observationIds": [
        "generic.atwiki88.03"
      ],
      "identityBasis": "selected-source-topic-not-native-id"
    },
    {
      "eventId": "generic.recommend-military-officer",
      "observationIds": [
        "generic.atwiki88.04"
      ],
      "identityBasis": "selected-source-topic-not-native-id"
    },
    {
      "eventId": "generic.five-tiger-generals",
      "observationIds": [
        "generic.atwiki88.05"
      ],
      "identityBasis": "selected-source-topic-not-native-id"
    },
    {
      "eventId": "generic.discover-ruins",
      "observationIds": [
        "generic.atwiki88.06"
      ],
      "identityBasis": "selected-source-topic-not-native-id"
    },
    {
      "eventId": "generic.discover-shrine",
      "observationIds": [
        "generic.atwiki88.07"
      ],
      "identityBasis": "selected-source-topic-not-native-id"
    },
    {
      "eventId": "generic.destroy-ruins-or-shrine",
      "observationIds": [
        "generic.atwiki88.08"
      ],
      "identityBasis": "selected-source-topic-not-native-id"
    },
    {
      "eventId": "generic.shao-emperor-accession",
      "observationIds": [
        "generic.atwiki88.09"
      ],
      "identityBasis": "selected-source-topic-not-native-id"
    },
    {
      "eventId": "generic.xian-emperor-accession",
      "observationIds": [
        "generic.atwiki88.10"
      ],
      "identityBasis": "selected-source-topic-not-native-id"
    },
    {
      "eventId": "generic.xian-emperor-death",
      "observationIds": [
        "generic.atwiki88.11"
      ],
      "identityBasis": "selected-source-topic-not-native-id"
    },
    {
      "eventId": "generic.visit-guan-lu",
      "observationIds": [
        "generic.atwiki88.12"
      ],
      "identityBasis": "selected-source-topic-not-native-id"
    },
    {
      "eventId": "generic.visit-xu-shao",
      "observationIds": [
        "generic.atwiki88.13"
      ],
      "identityBasis": "selected-source-topic-not-native-id"
    },
    {
      "eventId": "generic.visit-hua-tuo",
      "observationIds": [
        "generic.atwiki88.14"
      ],
      "identityBasis": "selected-source-topic-not-native-id"
    },
    {
      "eventId": "generic.visit-yu-ji",
      "observationIds": [
        "generic.atwiki88.15"
      ],
      "identityBasis": "selected-source-topic-not-native-id"
    },
    {
      "eventId": "generic.visit-mi-heng",
      "observationIds": [
        "generic.atwiki88.16"
      ],
      "identityBasis": "selected-source-topic-not-native-id"
    },
    {
      "eventId": "generic.visit-sima-hui-a",
      "observationIds": [
        "generic.atwiki88.17"
      ],
      "identityBasis": "selected-source-topic-not-native-id"
    },
    {
      "eventId": "generic.visit-sima-hui-b",
      "observationIds": [
        "generic.atwiki88.18"
      ],
      "identityBasis": "selected-source-topic-not-native-id"
    },
    {
      "eventId": "generic.visit-huang-cheng-yan",
      "observationIds": [
        "generic.atwiki88.19"
      ],
      "identityBasis": "selected-source-topic-not-native-id"
    },
    {
      "eventId": "generic.spousal-help",
      "observationIds": [
        "generic.atwiki88.20"
      ],
      "identityBasis": "selected-source-topic-not-native-id"
    },
    {
      "eventId": "generic.sworn-brothers-spirit",
      "observationIds": [
        "generic.atwiki88.21"
      ],
      "identityBasis": "selected-source-topic-not-native-id"
    },
    {
      "eventId": "generic.taishan-fengshan",
      "observationIds": [
        "generic.atwiki88.22",
        "generic.gamersky2009.13.taishan"
      ],
      "identityBasis": "selected-source-topic-not-native-id"
    },
    {
      "eventId": "generic.volunteers",
      "observationIds": [
        "generic.atwiki88.23"
      ],
      "identityBasis": "selected-source-topic-not-native-id"
    },
    {
      "eventId": "generic.petition",
      "observationIds": [
        "generic.atwiki88.24"
      ],
      "identityBasis": "selected-source-topic-not-native-id"
    },
    {
      "eventId": "generic.disaster-aid",
      "observationIds": [
        "generic.atwiki88.25"
      ],
      "identityBasis": "selected-source-topic-not-native-id"
    },
    {
      "eventId": "generic.han-emperor-secret-envoy",
      "observationIds": [
        "generic.atwiki88.26"
      ],
      "identityBasis": "selected-source-topic-not-native-id"
    },
    {
      "eventId": "generic.aid-han-emperor",
      "observationIds": [
        "generic.atwiki88.27"
      ],
      "identityBasis": "selected-source-topic-not-native-id"
    },
    {
      "eventId": "generic.praise",
      "observationIds": [
        "generic.atwiki88.28"
      ],
      "identityBasis": "selected-source-topic-not-native-id"
    },
    {
      "eventId": "generic.slander",
      "observationIds": [
        "generic.atwiki88.29"
      ],
      "identityBasis": "selected-source-topic-not-native-id"
    },
    {
      "eventId": "generic.study-report-intellect",
      "observationIds": [
        "generic.atwiki88.30"
      ],
      "identityBasis": "selected-source-topic-not-native-id"
    },
    {
      "eventId": "generic.study-report-military",
      "observationIds": [
        "generic.atwiki88.31"
      ],